reference_id,source_type,tetrad_dimensions,reference_entry
[133],Academic literature,Enhances; Obsolesces; Retrieves; Reverses,"[133] Ketai Qiu, Niccolò Puccinelli, Matteo Ciniselli, and Luca Di Grazia. 2025. From Today’s Code to Tomorrow’s Symphony: The AI Transformation of Developer’s Routine by 2030. ACM Trans. Softw. Eng. Methodol. 34, 5, Article 121 (May 2025), 17 pages. doi:10.1145/3709353"
[134],Academic literature,Reverses,"[134] Dannilo Rabelo, Albert Lopes, Wendy Mendes, Cleidson de Souza, Kiev Gama, Danilo Monteiro, and Gustavo Pinto. 2022. The Role of Non-Technical Skills in the Software Development Market. In Proceedings of the XXXVI Brazilian Symposium on Software Engineering (Virtual Event, Brazil) (SBES ’22). Association for Computing Machinery, New York, NY, USA, 31–40. doi:10.1145/3555228.3555254"
[135],Academic literature,Retrieves,[135] Nicole M. Radziwill and Morgan C. Benton. 2017. Evaluating Quality of Chatbots and Intelligent Conversational Agents. arXiv:1704.04579 [cs.CY] https://arxiv.org/abs/1704.04579
[137],Industry/practitioner/community source,Reverses,[137] Joanna Riley. 2020. How AI Can Help Companies to Reward Their Employees. Medium. https://medium.com/@joanna.riley/how-ai-can-helpcompanies-to-reward-their-employees-6b11b629ccba
[138],Academic literature,Obsolesces; Reverses,"[138] Jennifer Rix. 2022. From Tools to Teammates: Conceptualizing Humans’ Perception of Machines as Teammates with a Systematic Literature Review. In 55th Hawaii International Conference on System Sciences, HICSS 2022, Virtual Event / Maui, Hawaii, USA, January 4-7, 2022. ScholarSpace, 1–10. http://hdl.handle.net/10125/79378"
[139],Academic literature,Reverses,"[139] Diana Robinson, Christian Cabrera, Andrew D. Gordon, Neil D. Lawrence, and Lars Mennen. 2025. Requirements Are All You Need: The Final Frontier for End-User Software Engineering. ACM Trans. Softw. Eng. Methodol. 34, 5, Article 141 (May 2025), 22 pages. doi:10.1145/3708524"
[140],Academic literature,Reverses,"[140] Krishna Ronanki, Simon Arvidsson, and Johan Axell. 2025. Prompt Engineering Guidelines for Using Large Language Models in Requirements Engineering. In Software Engineering and Advanced Applications: 51st Euromicro Conference, SEAA 2025, Salerno, Italy, September 10–12, 2025, Proceedings, Part III (Salerno, Italy). Springer-Verlag, Berlin, Heidelberg, 245–262. doi:10.1007/978-3-032-04207-1_17"
[141],Academic literature,Reverses,"[141] Krishna Ronanki, Beatriz Cabrero-Daniel, Jennifer Horkoff, and Christian Berger. 2024. Requirements Engineering Using Generative AI: Prompts and Prompting Patterns. Springer Nature Switzerland, Cham, 109–127. doi:10.1007/978-3-031-55642-5_5"
[142],Academic literature,Enhances; Retrieves; Reverses,"[142] Abhik Roychoudhury, Corina Păsăreanu, Michael Pradel, and Baishakhi Ray. 2025. Agentic AI Software Engineers: Programming with Trust. arXiv preprint arXiv:2502.13767 1, 1 (May 2025), 1–5. doi:10.48550/arXiv.2502.13767"
[144],Academic literature,Enhances; Obsolesces; Reverses,"[144] Daniel Russo. 2024. Navigating the Complexity of Generative AI Adoption in Software Engineering. ACM Trans. Softw. Eng. Methodol. 33, 5, Article 135 (June 2024), 50 pages. doi:10.1145/3652154"
[145],Academic literature,Reverses,"[145] Filippo Santoni de Sio and Giulia Mecacci. 2021. Four Responsibility Gaps with Artificial Intelligence: Why they Matter and How to Address them. Philosophy & Technology 34 (2021), 1057–1084. doi:10.1007/s13347-021-00450-x"
[150],Academic literature,Reverses,"[150] Jan B. Schmutz, Neal Outland, Sarah Kerstan, Eirini Georganta, and Anna S. Ulfert. 2024. AI-teaming: Redefining collaboration in the digital era. Current Opinion in Psychology 58 (2024), 101837. doi:10.1016/j.copsyc.2024.101837"
[154],Academic literature,Enhances; Reverses,"[154] Manpreet Singh. 2024. The Impact of Artificial Intelligence on Software Development. International Journal of Computer and Artificial Intelligence 5, 2 (2024), 192–198. doi:10.33545/27076571.2024.v5.i2c.113"
[156],Industry/practitioner/community source,Obsolesces,[156] Arnold C. Subastil. 2020. The psychology behind rubber duck debugging. Medium. https://medium.com/@arnoldcsubastil/the-psychologybehind-rubber-duck-debugging-f19141c70060
[158],Academic literature,Reverses,"[158] Frédéric Tollon. 2022. Answerability, Accountability, and the Demands of Responsibility. In Artificial Intelligence Research. SACAIR 2022, A. Pillay, E. Jembere, and A. Gerber (Eds.). Communications in Computer and Information Science, Vol. 1734. Springer, Cham, —. doi:10.1007/978-3-03122321-1_25"
[159],Academic literature,Enhances; Retrieves,[159] Christoph Treude and Marco A. Gerosa. 2025. How Developers Interact with AI: A Taxonomy of Human-AI Collaboration in Software Engineering. In 2025 IEEE/ACM Second International Conference on AI Foundation Models and Software Engineering (Forge). 236–240. doi:10.1109/Forge66646. 2025.00033
[160],Academic literature,Enhances,"[160] Andreas Tsamados, Luciano Floridi, and Mariarosaria Taddeo. 2024. Human control of AI systems: from supervision to teaming. AI and Ethics (May 2024). doi:10.1007/s43681-024-00489-4"
[161],Academic literature,Enhances,"[161] Tien Rahayu Tulili, Andrea Capiluppi, and Ayushi Rastogi. 2023. Burnout in software engineering: A systematic mapping study. Information and Software Technology 155 (March 2023). doi:10.1016/j.infsof.2022.107116"
[162],Academic literature,Enhances; Obsolesces; Reverses,"[162] Rasmus Ulfsnes, Nils Brede Moe, Viktoria Stray, and Marianne Skarpen. 2024. Transforming Software Development with Generative AI: Empirical Insights on Collaboration and Workflow. arXiv:2405.01543 [cs.SE] https://arxiv.org/abs/2405.01543"
[164],Academic literature,Obsolesces,"[164] Piet Van den Bossche, Wim Gijselaers, Mien Segers, and Paul A. Kirschner. 2011. Team learning: building shared mental models. Instructional Science 39, 3 (2011), 283–301. doi:10.1007/s11251-010-9128-3"
[165],Academic literature,Enhances,"[165] A. M. Vieriu and G. Petrea. 2025. The Impact of Artificial Intelligence (AI) on Students’ Academic Development. Education Sciences 15, 3 (2025), 343. doi:10.3390/educsci15030343"
[166],Academic literature,Retrieves,"[166] Richard S. Wallace. 2009. The Anatomy of A.L.I.C.E. In Parsing the Turing Test, Robert Epstein, Gary Roberts, and Grace Beber (Eds.). Springer, Dordrecht. doi:10.1007/978-1-4020-6710-5_13"
[167],Academic literature,Reverses,"[167] Qing Wang, Junjie Wang, Mingyang Li, Yawen Wang, and Zhe Liu. 2025. A Roadmap for Software Testing in Open-Collaborative and AI-Powered Era. ACM Trans. Softw. Eng. Methodol. 34, 5, Article 148 (May 2025), 17 pages. doi:10.1145/3709355"
[170],Academic literature,Retrieves,"[170] Joseph Weizenbaum. 1966. ELIZA—a computer program for the study of natural language communication between man and machine. Commun. ACM 9, 1 (Jan. 1966), 36–45. doi:10.1145/365153.365168"
[171],Academic literature,Enhances; Retrieves,"[171] Alisa Welter, Niklas Schneider, Tobias Dick, Kallistos Weis, Christof Tinnes, Marvin Wyrich, and Sven Apel. 2025. From Developer Pairs to AI Copilots: A Comparative Study on Knowledge Transfer. arXiv:2506.04785 [cs.SE] https://arxiv.org/abs/2506.04785"
[174],Other supporting source,Enhances; Obsolesces; Retrieves; Reverses,"[174] Jessica L. Wildman, Daniel Nguyen, Amanda L. Thayer, Valerie T. Robbins-Roth, Meredith Carroll, Kendall Carmody, Cherrise Ficke, Mohammed Akib, and Arianna Addis. 2024. Trust in Human-Agent Teams: A Multilevel Perspective and Future Research Agenda. Organizational Psychology Review 14 (2024), 373 – 402. https://api.semanticscholar.org/CorpusID:269998905"
[178],Academic literature,Enhances,"[178] Albert Ziegler, Eirini Kalliamvakou, X. Alice Li, Andrew Rice, Devon Rifkin, Shawn Simister, Ganesh Sittampalam, and Edward Aftandilian. 2024. Measuring GitHub Copilot’s Impact on Productivity. Commun. ACM 67, 3 (Feb. 2024), 54–63. doi:10.1145/3633453 Manuscript submitted to ACM Agentic AI in Software Engineering: tools or team members? 61"
[179],Industry/practitioner/community source,Reverses,[179] Zuperly. 2022. Focused and Diffuse Modes of Thinking. Medium. https://gozuperly.medium.com/focused-and-diffuse-modes-of-thinking61286902c294
