Authors,Author(s) ID,Title,Year,Source title,Volume,Issue,Art. No.,Page start,Page end,Page count,Cited by,DOI,Link,Document Type,Publication Stage,Open Access,Source,EID
"Rigaki, M., Catania, C.A., García, S.","57200796111;36979424100;55712953900;","Building adaptative and transparent cyber agents with local language models",2026,"Expert Systems with Applications","299",,,"","",0,,"10.1016/j.eswa.2025.129987","https://www.scopus.com/inward/record.uri?eid=2-s2.0-105020814407&doi=10.1016%2fj.eswa.2025.129987&partnerID=40&md5=d7fd926212150fc3fdcbb10d35f9be65",Article,"Final","",Scopus,2-s2.0-105020814407
"Lestingi, L., Bersani, M.M., Camilli, M., Mirandola, R., Rossi, M., Scandurra, P.","57219181705;35730853100;55320192900;56240209400;7403708768;55912922200;","Proactive self-adaptation and assurance of explainable Human–Machine Teaming",2026,"Journal of Systems and Software","232",,"112657","","",0,,"10.1016/j.jss.2025.112657","https://www.scopus.com/inward/record.uri?eid=2-s2.0-105018914817&doi=10.1016%2fj.jss.2025.112657&partnerID=40&md5=9dcb6be4630d9c9385b7bcd6cde045f1",Article,"Final","All Open Access, Green",Scopus,2-s2.0-105018914817
"Patel, K., Shah, M., Qureshi, K.M., Qureshi, M.R.N.","57667914100;57772416900;57720086100;22986225600;","A systematic review of generative AI: importance of industry and startup-centered perspectives, agentic AI, ethical considerations & challenges, and future directions",2026,"Artificial Intelligence Review","59","1","7","","",0,,"10.1007/s10462-025-11435-z","https://www.scopus.com/inward/record.uri?eid=2-s2.0-105021487123&doi=10.1007%2fs10462-025-11435-z&partnerID=40&md5=302cb10ea8a97963e9e6169fc048dd79",Article,"Final","All Open Access, Hybrid Gold",Scopus,2-s2.0-105021487123
"Vaidhyanathan, K., Taibi, D.","57209110229;55920884000;","Agentic AI Frameworks Under the Microscope: What Works, What Doesn’t",2026,"IEEE Software","43","1",,"133","138",0,,"10.1109/MS.2025.3622209","https://www.scopus.com/inward/record.uri?eid=2-s2.0-105026858981&doi=10.1109%2fMS.2025.3622209&partnerID=40&md5=93800c349b9cd5809a5532a3e586159d",Review,"Final","All Open Access, Hybrid Gold",Scopus,2-s2.0-105026858981
"Devanbu, P.T., Baudry, B., Voas, J.","35583833100;57203847520;57203071719;","Promises and Perils of LLM- and Agent-Generated Code",2026,"Computer","59","1",,"184","186",0,,"10.1109/MC.2025.3627694","https://www.scopus.com/inward/record.uri?eid=2-s2.0-105026753138&doi=10.1109%2fMC.2025.3627694&partnerID=40&md5=1ddd824057f2c82fe3d355403b6f74a3",Article,"Final","",Scopus,2-s2.0-105026753138
"Khadem, E.A., Movaghar, A.","54418884000;6603397985;","From challenges to metrics: An LLM-driven DevOps recommendation system grounded in evidence-based mappings",2025,"Array","28",,"100547","","",0,,"10.1016/j.array.2025.100547","https://www.scopus.com/inward/record.uri?eid=2-s2.0-105019272672&doi=10.1016%2fj.array.2025.100547&partnerID=40&md5=d56df9a79d09dd059abb7312abad1d12",Review,"Final","All Open Access, Gold, Green",Scopus,2-s2.0-105019272672
"Sheng, Z., Chen, Z., Gu, S., Huang, H., Gu, G., Huang, J.","59637880200;58953990200;59636142800;57218365315;14025549700;57013582200;","LLMs in Software Security: A Survey of Vulnerability Detection Techniques and Insights",2025,"ACM Computing Surveys","58","5","134","","",0,2,"10.1145/3769082","https://www.scopus.com/inward/record.uri?eid=2-s2.0-105025576701&doi=10.1145%2f3769082&partnerID=40&md5=bc9a2112816903e2a57aed6139bf4f36",Article,"Final","All Open Access, Hybrid Gold",Scopus,2-s2.0-105025576701
"Wang, Y., Zhong, W., Huang, Y., Shi, E., Yang, M., Chen, J., Li, H., Ma, Y., Wang, Q., Zheng, Z.","57222817085;57211975950;57944072900;57226182242;56349712700;57184505400;57211503963;57832420700;57208587889;25224189400;","Agents in software engineering: survey, landscape, and vision",2025,"Automated Software Engineering","32","2","70","","",0,,"10.1007/s10515-025-00544-2","https://www.scopus.com/inward/record.uri?eid=2-s2.0-105012856499&doi=10.1007%2fs10515-025-00544-2&partnerID=40&md5=b2efd2eb3819480e8a12b2c33e43b697",Article,"Final","",Scopus,2-s2.0-105012856499
"Roque, G., Nascimento, J., Souza, R., Alves, C., Araújo, J.","57444838900;57801970100;55695071600;24477033800;12802236400;","Trust requirements in sociotechnical systems: A systematic literature review",2025,"Information and Software Technology","186",,"107796","","",0,,"10.1016/j.infsof.2025.107796","https://www.scopus.com/inward/record.uri?eid=2-s2.0-105007870193&doi=10.1016%2fj.infsof.2025.107796&partnerID=40&md5=b0ff0f3c3f2e66966c8cfce885e71941",Review,"Final","",Scopus,2-s2.0-105007870193
"Piccialli, F., Chiaro, D., Sarwar, S., Cerciello, D., Qi, P., Mele, V.","42762051900;57870076700;57267073900;59389642400;57216837345;55754144300;","AgentAI: A comprehensive survey on autonomous agents in distributed AI for industry 4.0",2025,"Expert Systems with Applications","291",,"128404","","",0,12,"10.1016/j.eswa.2025.128404","https://www.scopus.com/inward/record.uri?eid=2-s2.0-105007659883&doi=10.1016%2fj.eswa.2025.128404&partnerID=40&md5=a72ca1b90b38f2438ae12234fdd4605a",Review,"Final","All Open Access, Hybrid Gold",Scopus,2-s2.0-105007659883
"Porter, Z., Calinescu, R., Lim, E., Hodge, V., Ryan, P., Burton, S., Habli, I., Lawton, T., McDermid, J., Molloy, J., Monkhouse, H., Morgan, P., Noordhof, P., Paterson, C., Standen, I., Zou, J.","57208588600;6507842838;57219600845;7004904183;59399892000;57195678486;23466763400;54585517800;7006615990;57864925500;54915725300;53863967600;6508178115;57188871679;58823812100;57804187900;","INSYTE: A Classification Framework for Traditional to Agentic AI Systems",2025,"ACM Transactions on Autonomous and Adaptive Systems","20","3","15","","",0,,"10.1145/3760424","https://www.scopus.com/inward/record.uri?eid=2-s2.0-105018741498&doi=10.1145%2f3760424&partnerID=40&md5=5dfb138f7f2a753246eda027188f53da",Article,"Final","All Open Access, Bronze",Scopus,2-s2.0-105018741498
"Li, J., Gao, Y., Yang, Y., Bai, Y., Zhou, X., Li, Y., Sun, H., Liu, Y., Si, X., Ye, Y., Wu, Y., Lin, Y., Xu, B., Ren, B., Feng, C., Huang, H.","57551515900;57203915177;57549570000;57212062655;58999091200;58653686400;58678738400;58871807900;59336188800;59335356700;58728377500;59336025700;59335527100;59335199500;35182844100;7405614195;","Fundamental Capabilities and Applications of Large Language Models: A Survey",2025,"ACM Computing Surveys","58","2","38","","",0,4,"10.1145/3735632","https://www.scopus.com/inward/record.uri?eid=2-s2.0-105020264634&doi=10.1145%2f3735632&partnerID=40&md5=2277421d9ca290f03d014bcd02ad7e14",Article,"Final","",Scopus,2-s2.0-105020264634
"Banh, L., Holldack, F., Strobel, G.","58639590200;59730926600;57205729621;","Copiloting the future: How generative AI transforms Software Engineering",2025,"Information and Software Technology","183",,"107751","","",0,11,"10.1016/j.infsof.2025.107751","https://www.scopus.com/inward/record.uri?eid=2-s2.0-105002314681&doi=10.1016%2fj.infsof.2025.107751&partnerID=40&md5=70f11299b67ce4a98a1d7fdd1b04ff49",Article,"Final","All Open Access, Hybrid Gold",Scopus,2-s2.0-105002314681
"Hosseini, S., Seilani, H.","55420256100;57212461205;","The role of agentic AI in shaping a smart future: A systematic review",2025,"Array","26",,"100399","","",0,40,"10.1016/j.array.2025.100399","https://www.scopus.com/inward/record.uri?eid=2-s2.0-105005099002&doi=10.1016%2fj.array.2025.100399&partnerID=40&md5=7a32ef53eeb636416c9e2d3b81fdc69f",Review,"Final","All Open Access, Gold, Green",Scopus,2-s2.0-105005099002
"Bi, J., Wang, Z., Yuan, H., Shi, X., Wang, Z., Zhang, J., Zhou, M., Buyya, R.","55847050400;57393020000;36652221400;59522949700;59522949800;59836152700;7403506743;57194845546;","Large AI Models and Their Applications: Classification, Limitations, and Potential Solutions",2025,"Software Practice and Experience","55","6",,"1003","1017",0,4,"10.1002/spe.3408","https://www.scopus.com/inward/record.uri?eid=2-s2.0-85215670407&doi=10.1002%2fspe.3408&partnerID=40&md5=84b0e5b7d97b44909bd54f29dde51d5d",Article,"Final","",Scopus,2-s2.0-85215670407
"Autili, M., De Sanctis, M., Inverardi, P., Pelliccione, P.","21741922600;56358489900;57192813016;8852257900;","Engineering Digital Systems for Humanity: A Research Roadmap",2025,"ACM Transactions on Software Engineering and Methodology","34","5","130","","",0,9,"10.1145/3712006","https://www.scopus.com/inward/record.uri?eid=2-s2.0-105008794894&doi=10.1145%2f3712006&partnerID=40&md5=af5bfc1b13556c98ee5b255a11f9744e",Article,"Final","All Open Access, Hybrid Gold",Scopus,2-s2.0-105008794894
"Gao, C., Hu, X., Gao, S., Xia, X., Jin, Z.","57189036288;57191413796;59187731100;54586248800;8961795500;","The Current Challenges of Software Engineering in the Era of Large Language Models",2025,"ACM Transactions on Software Engineering and Methodology","34","5","127","","",0,13,"10.1145/3712005","https://www.scopus.com/inward/record.uri?eid=2-s2.0-105008811572&doi=10.1145%2f3712005&partnerID=40&md5=18b11acc2ae994ce529fa7525a31f5fd",Article,"Final","",Scopus,2-s2.0-105008811572
"Zhou, X., Cao, S., Sun, X., Lo, D.","57770923400;57222584216;24829988300;35269388000;","Large Language Model for Vulnerability Detection and Repair: Literature Review and the Road Ahead",2025,"ACM Transactions on Software Engineering and Methodology","34","5","145","","",0,25,"10.1145/3708522","https://www.scopus.com/inward/record.uri?eid=2-s2.0-105008775348&doi=10.1145%2f3708522&partnerID=40&md5=1b656bd8c226abbb5e3f2a7c1faa142f",Review,"Final","All Open Access, Hybrid Gold",Scopus,2-s2.0-105008775348
"Robinson, D., Cabrera, C., Gordon, A.D., Lawrence, N.D., Mennen, L.","57474781300;57194575477;7402141419;9279186200;59165566500;","Requirements Are All You Need: The Final Frontier for End-User Software Engineering",2025,"ACM Transactions on Software Engineering and Methodology","34","5","141","","",0,7,"10.1145/3708524","https://www.scopus.com/inward/record.uri?eid=2-s2.0-105008810119&doi=10.1145%2f3708524&partnerID=40&md5=fdc3e7a98e1c2770cff6f37757c75f5e",Article,"Final","All Open Access, Hybrid Gold",Scopus,2-s2.0-105008810119
"Jackson, V., Vasilescu, B., Russo, D., Ralph, P., Prikladnicki, R., Izadi, M., D'Angelo, S., Inman, S., Andrade, A., Van Der Hoek, A.","57467443300;42062536300;57119027600;12239104000;13612977400;57212699639;58285429500;55913715200;59957961600;7004156271;","The Impact of Generative AI on Creativity in Software Development: A Research Agenda",2025,"ACM Transactions on Software Engineering and Methodology","34","5","133","","",0,4,"10.1145/3708523","https://www.scopus.com/inward/record.uri?eid=2-s2.0-105008817694&doi=10.1145%2f3708523&partnerID=40&md5=0ec68721d29662dcee9f7f50af4e8505",Article,"Final","All Open Access, Hybrid Gold",Scopus,2-s2.0-105008817694
"He, J., Treude, C., Lo, D.","57432691900;23135531900;35269388000;","LLM-Based Multi-Agent Systems for Software Engineering: Literature Review, Vision, and the Road Ahead",2025,"ACM Transactions on Software Engineering and Methodology","34","5","124","","",0,38,"10.1145/3712003","https://www.scopus.com/inward/record.uri?eid=2-s2.0-105007498449&doi=10.1145%2f3712003&partnerID=40&md5=7d6de041ff2697674d3958ec406abb3a",Article,"Final","",Scopus,2-s2.0-105007498449
"Deng, Z., Guo, Y., Han, C., Ma, W., Xiong, J., Wen, S., Xiang, Y.","59174516000;59164691300;59205577300;57196052588;35753908700;37108669800;57114147900;","AI Agents Under Threat: A Survey of Key Security Challenges and Future Pathways",2025,"ACM Computing Surveys","57","7","182","","",0,65,"10.1145/3716628","https://www.scopus.com/inward/record.uri?eid=2-s2.0-86000562068&doi=10.1145%2f3716628&partnerID=40&md5=399ee13048c998e32ddb620ff408571f",Article,"Final","",Scopus,2-s2.0-86000562068
"Getir Yaman, S., Ribeiro, P., Cavalcanti, A., Calinescu, R., Paterson, C., Townsend, B.","42961488200;58582125900;56265113000;6507842838;57188871679;57214235631;","Specification, validation and verification of social, legal, ethical, empathetic and cultural requirements for autonomous agents",2025,"Journal of Systems and Software","220",,"112229","","",0,4,"10.1016/j.jss.2024.112229","https://www.scopus.com/inward/record.uri?eid=2-s2.0-85208655817&doi=10.1016%2fj.jss.2024.112229&partnerID=40&md5=b90deca0653fe710b0ee7594a6350b5c",Article,"Final","All Open Access, Hybrid Gold, Green",Scopus,2-s2.0-85208655817
"Liu, Y., Lo, S.K., Lu, Q., Zhu, L., Zhao, D., Xu, X., Harrer, S., Whittle, J.","57202010999;57219797348;56431802100;7404202229;56814028500;55706225900;24314589900;23006933800;","Agent design pattern catalogue: A collection of architectural patterns for foundation model based agents",2025,"Journal of Systems and Software","220",,"112278","","",0,12,"10.1016/j.jss.2024.112278","https://www.scopus.com/inward/record.uri?eid=2-s2.0-85209237729&doi=10.1016%2fj.jss.2024.112278&partnerID=40&md5=33993a8f708303f2e5c0a8dfeef35af9",Article,"Final","All Open Access, Hybrid Gold",Scopus,2-s2.0-85209237729
"Kapoor, S., Stroebl, B., Siegel, Z.S., Nadgir, N., Narayanan, A.","57203863908;59235054500;57222144767;58938567200;14034426100;","AI Agents That Matter",2025,"Transactions on Machine Learning Research","2025-May",,,"","",0,2,,"https://www.scopus.com/inward/record.uri?eid=2-s2.0-105008530567&partnerID=40&md5=5e7c6d723f1797109f8828db4031d8bd",Article,"Final","",Scopus,2-s2.0-105008530567
"Panyam, S., Gujar, P., Lin, H.-Y.","59261645900;59261464900;36546384600;","How AI Agents Are Transforming Software Engineering and the Future of Product Development",2025,"Computer","58","5",,"71","77",0,,"10.1109/MC.2024.3488378","https://www.scopus.com/inward/record.uri?eid=2-s2.0-105026322739&doi=10.1109%2fMC.2024.3488378&partnerID=40&md5=7e9fdc9ccdb573296421b77dffc0e705",Article,"Final","",Scopus,2-s2.0-105026322739
"Lambiase, S., Catolino, G., Palomba, F., Ferrucci, F.","57219252610;57131181700;55321369000;7003406181;","Motivations, Challenges, Best Practices, and Benefits for Bots and Conversational Agents in Software Engineering: A Multivocal Literature Review",2024,"ACM Computing Surveys","57","4","93","","",0,3,"10.1145/3704806","https://www.scopus.com/inward/record.uri?eid=2-s2.0-85214816282&doi=10.1145%2f3704806&partnerID=40&md5=fc9f7f4f5a6f1863163c4c78071570de",Article,"Final","All Open Access, Hybrid Gold, Green",Scopus,2-s2.0-85214816282
"Zhang, Z., Chen, C., Liu, B., Liao, C., Gong, Z., Yu, H., Li, J., Wang, R.","58315400800;58106092700;57204643589;57747061300;58664372100;55267096200;55924903000;57307350400;","Unifying the Perspectives of NLP and Software Engineering: A Survey on Language Models for Code",2024,"Transactions on Machine Learning Research","2024",,,"1","125",0,4,,"https://www.scopus.com/inward/record.uri?eid=2-s2.0-105000655240&partnerID=40&md5=74ff896f4ed0d5eb3c7533ab951c0f57",Article,"Final","",Scopus,2-s2.0-105000655240
